{
  "$schema": "http://json-schema.org/draft-07/schema#",
  "additionalProperties": false,
  "definitions": {
    "BrokerInfo": {
      "additionalProperties": false,
      "description": "Broker identity information in responses.",
      "properties": {
        "ElevatedSimulation": {
          "description": "Whether the broker is running in simulated elevation mode.",
          "type": "boolean"
        },
        "Name": {
          "description": "Broker display name.",
          "maxLength": 128,
          "minLength": 1,
          "type": "string"
        },
        "PipeName": {
          "description": "Named pipe path (when transport is http-named-pipe).",
          "maxLength": 256,
          "minLength": 1,
          "type": [
            "string",
            "null"
          ]
        },
        "ProtocolVersion": {
          "allOf": [
            {
              "$ref": "#/definitions/protocolVersion"
            }
          ],
          "description": "Protocol version (e.g., \"1.0\")."
        },
        "Transport": {
          "allOf": [
            {
              "$ref": "#/definitions/Transport"
            }
          ],
          "description": "Transport mechanism."
        }
      },
      "required": [
        "ElevatedSimulation",
        "Name",
        "ProtocolVersion",
        "Transport"
      ],
      "type": "object"
    },
    "OperationStatus": {
      "description": "Status of an asynchronous package operation.",
      "oneOf": [
        {
          "description": "Process is being prepared/started.",
          "enum": [
            "Starting"
          ],
          "type": "string"
        },
        {
          "description": "Process is running.",
          "enum": [
            "Running"
          ],
          "type": "string"
        },
        {
          "description": "Process exited successfully (exit code 0).",
          "enum": [
            "Completed"
          ],
          "type": "string"
        },
        {
          "description": "Process failed (non-zero exit, timeout, or launch failure).",
          "enum": [
            "Failed"
          ],
          "type": "string"
        }
      ]
    },
    "PackageOperationStatusResponse": {
      "enum": [
        "PackageOperationStatusResponse"
      ],
      "type": "string"
    },
    "Transport": {
      "description": "Broker transport type.",
      "enum": [
        "HttpNamedPipe",
        "HttpLoopbackSimulator"
      ],
      "type": "string"
    },
    "protocolVersion": {
      "pattern": "^[0-9]+\\.[0-9]+$",
      "type": "string"
    },
    "resourceId": {
      "maxLength": 128,
      "pattern": "^[A-Za-z0-9][A-Za-z0-9._:\\-]{0,127}$",
      "type": "string"
    },
    "semanticVersion": {
      "maxLength": 128,
      "pattern": "^(0|[1-9]\\d*)\\.(0|[1-9]\\d*)\\.(0|[1-9]\\d*)(?:-((?:0|[1-9]\\d*|\\d*[A-Za-z-][0-9A-Za-z-]*)(?:\\.(?:0|[1-9]\\d*|\\d*[A-Za-z-][0-9A-Za-z-]*))*))?(?:\\+([0-9A-Za-z-]+(?:\\.[0-9A-Za-z-]+)*))?$",
      "type": "string"
    },
    "statusResponseSchemaUri": {
      "enum": [
        "https://aka.ms/unigetui/package-operation-status-response.schema.1.0.json"
      ],
      "type": "string"
    }
  },
  "description": "Response to a status query.",
  "properties": {
    "$schema": {
      "allOf": [
        {
          "$ref": "#/definitions/statusResponseSchemaUri"
        }
      ],
      "description": "Status response schema URI constant."
    },
    "Broker": {
      "allOf": [
        {
          "$ref": "#/definitions/BrokerInfo"
        }
      ],
      "description": "Broker identity and capabilities."
    },
    "CompletedAt": {
      "description": "UTC timestamp when the operation completed or failed (null if still running).",
      "format": "date-time",
      "type": [
        "string",
        "null"
      ]
    },
    "ExitCode": {
      "description": "Process exit code (present when status is `completed`, or `failed` due to non-zero exit).",
      "format": "int32",
      "type": [
        "integer",
        "null"
      ]
    },
    "Note": {
      "description": "Human-readable note about the status.",
      "maxLength": 2048,
      "type": [
        "string",
        "null"
      ]
    },
    "RequestId": {
      "allOf": [
        {
          "$ref": "#/definitions/resourceId"
        }
      ],
      "description": "The original request id being queried."
    },
    "ResponseType": {
      "allOf": [
        {
          "$ref": "#/definitions/PackageOperationStatusResponse"
        }
      ],
      "description": "Must be `\"packageOperationStatusResponse\"`."
    },
    "ResponseVersion": {
      "allOf": [
        {
          "$ref": "#/definitions/semanticVersion"
        }
      ],
      "description": "Response syntax version (semver)."
    },
    "StartedAt": {
      "description": "UTC timestamp when the process was actually launched (null if not yet started).",
      "format": "date-time",
      "type": [
        "string",
        "null"
      ]
    },
    "Status": {
      "allOf": [
        {
          "$ref": "#/definitions/OperationStatus"
        }
      ],
      "description": "Current status of the operation."
    }
  },
  "required": [
    "$schema",
    "Broker",
    "RequestId",
    "ResponseType",
    "ResponseVersion",
    "Status"
  ],
  "title": "StatusResponse",
  "type": "object"
}