{
  "$schema": "https://aka.ms/unigetui/package-operation-status-response.schema.1.0.json",
  "ResponseVersion": "1.0.0",
  "ResponseType": "PackageOperationStatusResponse",
  "Broker": {
    "Name": "Devolutions Agent UniGetUI Broker",
    "ProtocolVersion": "1.0",
    "Transport": "HttpNamedPipe",
    "PipeName": "\\\\.\\pipe\\UniGetUI.PackageBroker.v1",
    "ElevatedSimulation": false
  },
  "RequestId": "req-long-running-op",
  "Status": "Failed",
  "StartedAt": "2026-05-05T11:00:00Z",
  "CompletedAt": "2026-05-05T12:00:00Z",
  "Note": "Operation timed out after 1 hour."
}